Item_ID,Item_Name_KO,Material_Name_EG,Item_Icon_Name,Particles_Name,Item_Type,Item_Text,Item_Color
130,진주 구피,Item_Fish_2,Icon_Item_Fish_2,-1,5,진주 색을 가진 구피이며 진주를 품고 있다. 1급수에만 서식하며. 그 외 급수의 물을 정화시키는 아주 이로운 개체이다.,
131,크리스탈 흰동가리,Item_Fish_3,Icon_Item_Fish_3,-1,5,민물에 사는 흰동가리로 온 몸이 크리스탈 광석으로 되어있다. 물에 빛을 반사하여 더욱 더 예쁘게 보이게끔 한다고도 전해진다.,
132,태양의 금붕어,Item_Fish_4,Icon_Item_Fish_4,-1,5,태양의 기운을 품고 있으며 몸 속엔 태양의 조각이 깃들어있다. 맨손으로 만지면 화상에 입으니 주의.,
133,진흙게,Item_Fish_5,Icon_Item_Fish_5,-1,5,민물 속 진흙에 숨어 사는 게이며 진흙과 같은 보호색을 띈다. 주변 환경에 영향을 잘 받아 맛 또한 진흙 맛이 난다고 한다. 허나 식재료를 넣어 요리하면 향이 잘 스며든다고 전해진다.,
134,나뭇가지,Item_Material_Branch_1,Icon_Item_Branch_1,-1,5,나무에서 떨어져 강에 빠진 나뭇가지. 쓰레기이며 1골드에 판매할 수 있다.,
